`1`~`7`~`2011-12-02 10:17:32.270000000`~`Не работает запись на прием`~`2011-12-02 11:04:29.333000000`~`1`~`7`~`2`~``~`1`|`2`~`48`~`2011-12-07 10:46:57.257000000`~`периодически не работает база `~`2011-12-07 14:41:07.793000000`~`1`~`5`~`2`~``~`1`|`3`~`314`~`2011-12-09 10:38:53.760000000`~`Не ввести личные данные представителя (они вводятся, но не в тот раздел, который нужен)`~`2012-06-21 16:53:29.140000000`~`1`~`395`~`1`~``~`1`|`4`~`291`~`2011-12-14 08:36:00.123000000`~`В программе Стройформ нет возможности вставлять информацию в электронном виде. `~`2011-12-16 09:20:08.580000000`~`1`~`5`~`1`~``~`1`|`5`~`48`~`2011-12-14 09:50:54.967000000`~`справка предупредительного контроля формируется только по контрольным картам,отсутствуют остальные разделы документооборота..  `~`2011-12-16 09:20:02.980000000`~`1`~`5`~`2`~``~`1`|`6`~`48`~`2011-12-14 09:51:43.993000000`~`повторно,Для формирования  итоговых форм необходима консультация  сотрудника Ниеншанц, `~`2011-12-16 09:20:06.360000000`~`1`~`5`~`2`~``~`1`|`7`~`48`~`2011-12-14 09:56:08.530000000`~`Запретить закрытие документов исполнителями до проверки исполнения, регистрации  сотрудником канцелярии Службы`~`2011-12-16 09:20:12.183000000`~`1`~`5`~`2`~``~`1`|`8`~`48`~`2011-12-14 09:57:47.620000000`~`После обновления Документооборота исчезли входящие, исходящие документы`~`2012-01-12 12:36:49.543000000`~`1`~`366`~`2`~``~`1`|`9`~`48`~`2011-12-14 10:00:09.817000000`~`Доработать отчет по обращениям в работе по рассмотрителям, реестр переданных документов, Сводка о ходе рассмотрения обращений`~`2012-01-12 12:36:49.543000000`~`1`~`366`~`2`~``~`1`|`10`~`48`~`2011-12-14 10:03:44.393000000`~`срочно необходимы  формы&quot;резолюция - ДОЛОЖИТЬ . срок&quot;   и Поручение &quot; ДОЛОЖИТЬ СРОК&quot;`~`2012-01-12 12:36:49.543000000`~`1`~`366`~`2`~``~`1`|`11`~`48`~`2011-12-14 10:28:18.430000000`~`не формируется реестр переданных документов`~`2012-01-12 12:36:49.543000000`~`1`~`366`~`2`~``~`1`|`12`~`48`~`2011-12-14 10:37:20.170000000`~`не формируется отчет  &quot; контроль сроков исполнения&quot;`~`2012-01-12 12:36:49.543000000`~`1`~`366`~`2`~``~`1`|`13`~`275`~`2011-12-14 11:42:32.073000000`~`Не работает программа`~`2011-12-22 10:01:42.493000000`~`1`~`366`~`1`~``~`1`|`14`~`165`~`2011-12-14 13:06:09.107000000`~`Не корректная работа программы при составлении документации. После орфографической проверки нет доступа к набираемому тексту, и к другим разделам программе. После каждого набора текста необходимо закрывать программу и входить заново. 
Прошу обеспечить НОРМАЛЬНУЮ работу программы.`~`2011-12-22 10:01:42.493000000`~`1`~`366`~`1`~``~`1`|`15`~`48`~`2011-12-15 12:36:16.127000000`~`{БизнесПроцесс.Исполнение.Форма.ФормаБизнесПроцесса.Форма(317)}: Значение не является значением объектного типа (БизнесПроцесс) –по №01-18-74/11
		ТекСтр.БизнесПроцесс=Объект.Ссылка;
`~`2012-01-12 12:36:49.543000000`~`1`~`366`~`2`~``~`1`|`16`~`48`~`2011-12-15 12:37:28.417000000`~`после отключения исчезли некоторые задачи рабочие процессы`~`2012-01-12 12:36:49.543000000`~`1`~`366`~`2`~``~`1`|`17`~`165`~`2011-12-16 08:15:01.790000000`~`Программа не работает.`~`2011-12-21 15:37:45.460000000`~`1`~`366`~`2`~``~`1`|`18`~`329`~`2011-12-16 11:47:19.020000000`~`при формировании текстового документа (акт и предписание) происходит смещение строчек, которое самостоятельно невозможно устранить`~`2011-12-29 15:47:12.560000000`~`1`~`366`~`1`~``~`1`|`19`~`165`~`2011-12-19 14:53:27.930000000`~`Программа не работает (не открывается)`~`2011-12-21 15:37:45.460000000`~`1`~`366`~`2`~``~`1`|`20`~`314`~`2011-12-26 13:30:38.790000000`~`Не вносится представитель в базу данных по организации (Строительство здание суда в г. Колпино)`~`2012-06-21 16:53:39.883000000`~`1`~`395`~`1`~``~`1`|`21`~`97`~`2011-12-27 09:34:57.097000000`~`Не обновляется Стройформ на компьютере Шеренешева А.В., каб.206`~`2011-12-27 10:54:09.150000000`~`1`~`366`~`1`~``~`1`|`22`~`97`~`2011-12-28 08:45:17.697000000`~`У Шеренешева А.В. (каб.206) не обновляется Стройформ, соответственно невозможно работать в данной программе`~`2011-12-28 09:13:27.457000000`~`1`~`366`~`1`~``~`1`|`23`~`165`~`2012-01-11 08:31:22.170000000`~`Не работает (не запускается) программа.`~`2012-01-11 09:21:19.473000000`~`1`~`366`~`2`~``~`1`|`24`~`306`~`2012-01-13 09:46:20.437000000`~`Открываю программу, требуется  запрос Логин - в списке моей фамилии нет!`~`2012-01-13 11:20:45.040000000`~`1`~`366`~`2`~``~`1`|`25`~`101`~`2012-01-13 10:38:08.803000000`~`Время 10-42 а 1 - С не работает, требует каких-то паролей, мне неизвестных. Срок исполнения документа сегодня, а я немогу ничего сделать! Позор и черти-что!`~`2012-01-13 11:23:21.710000000`~`1`~`366`~`2`~``~`1`|`26`~`125`~`2012-01-13 11:09:31.610000000`~`не работает. запрашивает пароль.`~`2012-01-13 11:23:21.710000000`~`1`~`366`~`2`~``~`1`|`27`~`101`~`2012-01-13 11:30:13.557000000`~`Dhtvz 11-30 а 1-С не работает! Сколько можно ждать? Срываются сроки написания ответа на обращение администрации района.`~`2012-01-13 11:42:45.370000000`~`1`~`366`~`2`~``~`1`|`28`~`165`~`2012-01-13 12:45:55.227000000`~`Нет прав доступа для занесения электронной версии дела по объекту.`~`2012-07-12 15:34:46.790000000`~`1`~`395`~`1`~``~`1`|`29`~`49`~`2012-01-24 16:08:35.320000000`~`Сергею подойти в канцелярию`~`2012-01-25 09:06:18.487000000`~`1`~`366`~`2`~``~`1`|`30`~`14`~`2012-01-25 17:20:06.100000000`~`не работает`~`2012-01-25 17:41:59.003000000`~`1`~`366`~`2`~``~`1`|`31`~`14`~`2012-01-25 17:37:35.177000000`~`ошибка устранилась`~`2012-01-25 17:41:59.003000000`~`1`~`366`~`2`~``~`1`|`32`~`192`~`2012-02-01 09:15:59.623000000`~`Не выдает сотрудника канцелярии`~`2012-03-16 09:58:46.890000000`~`1`~`366`~`2`~``~`1`|`33`~`49`~`2012-02-01 14:20:25.130000000`~`Сергею срочно подойти в канцелярию`~`2012-02-01 15:46:23.860000000`~`1`~`366`~`2`~``~`1`|`34`~`49`~`2012-02-02 09:32:35.723000000`~`Сергею позвонить в канцелярию`~`2012-02-06 10:12:10.197000000`~`1`~`366`~`2`~``~`1`|`35`~`49`~`2012-02-02 14:43:50.230000000`~`Сергею срочно подойти в канцелярию`~`2012-02-06 10:12:10.197000000`~`1`~`366`~`2`~``~`1`|`36`~`125`~`2012-02-03 09:46:01.267000000`~`нужен системный администратор
`~`2012-02-03 10:09:37.617000000`~`1`~`366`~`1`~``~`1`|`37`~`314`~`2012-02-03 12:24:03.937000000`~`Не распечатываются данные из предписаний`~`2012-02-03 12:55:14.600000000`~`1`~`366`~`1`~``~`1`|`38`~`14`~`2012-02-03 16:03:50.903000000`~`разъяснить недавние изменения в программе - невозможно осуществить поиск объекта!!!!!!!!!!!!`~`2012-02-03 16:21:42.960000000`~`1`~`366`~`1`~``~`1`|`39`~`165`~`2012-02-06 15:46:33.327000000`~`Не работает программа.`~`2012-02-06 16:01:44.253000000`~`1`~`366`~`2`~``~`1`|`40`~`49`~`2012-02-08 11:25:38.220000000`~`Сергею подойти переговорить по контролю сроков исполнения`~`2012-02-09 08:38:34.997000000`~`1`~`5`~`2`~``~`1`|`41`~`232`~`2012-02-13 12:07:01.900000000`~`Устанавливается ДЕМОНСТРАЦИОННЫЙ РЕЖИМ; внесённая информация не сохраняется`~`2012-02-13 13:56:13.710000000`~`1`~`366`~`1`~``~`1`|`42`~`49`~`2012-02-14 10:46:46.357000000`~`сергею срочно подойти в канцелярию`~`2012-02-14 12:25:22.857000000`~`1`~`366`~`2`~``~`1`|`43`~`49`~`2012-02-15 12:19:56.210000000`~`сергею подойьти в канц - сбился код у исходящих.`~`2012-02-16 14:32:50.730000000`~`1`~`5`~`2`~``~`1`|`44`~`232`~`2012-02-17 15:04:14.290000000`~`Проблемы в работе Стройформа. Нужна помощь!!!`~`2012-02-21 09:04:19.710000000`~`1`~`366`~`1`~``~`1`|`45`~`306`~`2012-02-22 11:47:17.997000000`~`При составлнии документов вместо моей фамилии выскакивает &quot;Лохотин Виталий Викторович ген.директор Форпост&quot;,; также не отражается номер отдела &quot;3&quot; получается просто /091....???? ; Вверху где место сотавление в протоколе &quot;г. Москва&quot;; в постановление вместо статьи 9.4 статья 3.5???`~`2012-03-29 10:45:15.013000000`~`1`~`366`~`1`~``~`1`|`46`~`49`~`2012-02-27 11:41:29.080000000`~`сбилась графа &quot;срок исполнения&quot;`~`2012-03-13 18:37:01.537000000`~`1`~`5`~`2`~``~`1`|`47`~`314`~`2012-02-29 16:46:04.023000000`~`не снимаются задачи при нажатии &quot;Исполнено&quot;, хотя письмо зарегистрировано`~`2012-05-22 17:19:24.563000000`~`1`~`366`~`2`~``~`1`|`48`~`314`~`2012-02-29 16:51:28.770000000`~`Не печатается полный адрес места составления акта, предписания и протокола, а только печатается город и буква &quot;г&quot; стоит после Санкт-Петербурга`~`2012-03-16 09:59:16.600000000`~`1`~`366`~`1`~``~`1`|`49`~`314`~`2012-02-29 16:56:40.900000000`~`Идет перенос статьи административного штрафа из страницы стройформа в word для распечатки документа с ошибкой (меняется с части 5-й статьи 9.5 на части 1-й статьи 9.4)`~`2012-03-16 09:59:28.427000000`~`1`~`366`~`1`~``~`1`|`50`~`314`~`2012-02-29 16:58:24.777000000`~`В постановлении в строчке, кто рассматривает постановление ошибки - отсутствует запятая и &quot;заместитель&quot; или &quot;начальник&quot; пишутся с большой буквы.`~`2012-02-29 17:08:51.793000000`~`1`~`366`~`1`~``~`1`|`51`~`314`~`2012-02-29 17:00:22.013000000`~`Необходимо согласовать напечатанные формы акта, предписания, протокола, постановления с юридическим отделом, так как юристы говорят, что с ними эти формы не согласованы.`~`2012-08-10 10:34:29.350000000`~`1`~`395`~`1`~``~`1`|`53`~`176`~`2012-03-02 11:46:04.220000000`~`Не возможно отправить заявку о неправильной работе при формировани документов программы стройформ`~`2012-03-16 09:01:55.430000000`~`1`~`366`~`1`~``~`1`|`54`~`176`~`2012-03-02 11:50:25.020000000`~`Программа некоректно, с нарушением законодательства формирует документы на печать. Административный протокол, постановление и предписание не соответствуют обязательным требованиям по форме. `~`2012-03-16 09:00:59.813000000`~`1`~`5`~`1`~``~`1`|`55`~`176`~`2012-03-02 11:54:27.350000000`~`При формировании административного протокола на печать не указываются время и место совершения правонарушения, точный адрес составления протокола, вместо строк для обязательных подписей выводятся table7  table 8  tableSvidetel`~`2012-03-16 09:00:54.940000000`~`1`~`5`~`1`~``~`1`|`56`~`176`~`2012-03-02 11:57:12.110000000`~`При формировани постановления на печать не указывается статья КоАП, которая нарушена, не указывается сумма штрафа, а также в форме не откорректированы суммы штрафов в соответстви с изменениями КоАП РФ`~`2012-03-16 09:00:37.880000000`~`1`~`5`~`1`~``~`1`|`57`~`176`~`2012-03-02 11:58:40.313000000`~`В предписании при выводе на печать не указывается побудительная часть - &quot;что нужно сделать&quot;`~`2012-03-14 14:22:50.773000000`~`1`~`366`~`1`~``~`1`|`58`~`49`~`2012-03-07 10:00:39.440000000`~`об отображении резолюции начальника в карточке задачи исполнителя `~`2012-10-26 08:19:21.130000000`~`1`~`5`~`2`~``~`1`|`59`~`346`~`2012-03-11 12:20:09.180000000`~`Нет доступа для просмотра разрешений на строительство и сроков их продлений по объектам капитального строительства.
 Выводится окно: у Вас нет уровня доступа для просмотра.`~`2012-07-10 18:18:00.383000000`~`1`~`395`~`1`~``~`1`|`61`~`173`~`2012-03-11 13:23:44.323000000`~`Не сохраняются измениния в документах, например в Акте, внесенные в программе Word. Необходимо объяснить порядок сохранения.`~`2012-03-14 09:12:10.347000000`~`1`~`366`~`1`~``~`1`|`62`~`173`~`2012-03-11 13:31:46.403000000`~`В основной форме Акта есть окно для отметки плановая или внеплановая проверка . При изменении данного указателя в акте,в сформированном документе, изменений не происходит.Необходимо заходить в раздел предмет и основание проверки. Смысл данных окон в основной форме акта теряется и вносит неразбериху в порядок отражения плановости проверки.`~`2012-03-29 10:45:48.873000000`~`1`~`366`~`1`~``~`1`|`63`~`173`~`2012-03-11 13:34:13.350000000`~`В документах Акт, Предписание, Протокол, сформированных в Word отсутствуют фамилии ответсвенных представителей заказчиков и застройщиков, подписывающих данные документы`~`2012-03-13 18:36:05.567000000`~`1`~`5`~`1`~``~`1`|`64`~`173`~`2012-03-11 13:39:55.970000000`~`При формировании Протокола и Постановления в программе Word, в случае указания нарушения в Акте в соответствии со статьей КоАП 9.5 пункт 5, в Протоколе и Постановлении отражается нарушения предусмотренные статьей 9.4 пункт 1.`~`2012-03-13 18:36:05.567000000`~`1`~`5`~`1`~``~`1`|`65`~`314`~`2012-03-16 09:15:00.120000000`~`При составлении постановления пишу: &quot; что руководствуясь частью 5-й статьей 9.5&quot;, а распичатывается в word - &quot;частью 1 статьи 9.4&quot;.`~`2012-03-16 09:58:16.900000000`~`1`~`366`~`1`~``~`1`|`66`~`165`~`2012-03-16 11:02:24.637000000`~`Не запускается программа.`~`2012-03-16 11:13:15.513000000`~`1`~`366`~`2`~``~`1`|`67`~`165`~`2012-03-19 15:26:56.700000000`~`Не запускается программа.`~`2012-03-19 15:56:22.370000000`~`1`~`366`~`2`~``~`1`|`68`~`346`~`2012-03-20 09:58:50.943000000`~`Нет доступа для просмотра разрешений на строительство и сроков их продлений по объектам капитального строительства. Выводится окно: у Вас нет уровня доступа для просмотра.`~`2012-07-11 09:02:51.293000000`~`1`~`395`~`1`~``~`1`|`69`~`48`~`2012-03-21 10:21:47.887000000`~`не дает возможности регистрировать документы -&quot;просит указать номер&quot;`~`2012-05-22 17:19:24.563000000`~`1`~`366`~`2`~``~`1`|`70`~`56`~`2012-03-21 18:04:59.110000000`~`Для оптимизации работы сектора санитарно-эпидемиологического надзора отдела надзора за специальными видами работ прошу Вас:
Рассмотреть возможность направления специалистам отдела надзора за специальными видами работ (по программе 1С) писем, извещений и др. документов заказчика (застройщика)  в которых указаны сроки переноса плановых проверок.
`~`2012-06-14 16:39:45.983000000`~`1`~`395`~`2`~``~`1`|`73`~`56`~`2012-03-22 10:57:50.400000000`~`Для оптимизации работы сектора санитарно-эпидемиологического надзора отдела надзора за специальными видами работ прошу Вас рассмотреть возможность  направления уведомлений о планируемых проверках вышеуказанным специалистам  за  5 рабочих дней (исключив направление уведомлений о плановых проверках в адрес специалистов сектора санитарно-эпидемиологического надзора, когда они не принимают участие у них).`~`2012-06-13 12:10:13.057000000`~`1`~`395`~`1`~``~`1`|`74`~`56`~`2012-03-22 10:58:09.707000000`~`Предусмотреть в последних числах месяца возможность просмотра списка адресов с указанием даты  проверки на последующий месяц (с учетом внесенных изменений по переносу плановых проверок). `~`2012-07-12 15:31:56.530000000`~`1`~`395`~`1`~``~`1`|`75`~`56`~`2012-03-22 11:08:28.973000000`~`Прошу Вас рассмотреть возможность увеличения диапазона просмотра составленных актов, предписаний, протоколов и т. д. в диапазоне более 7 дней и с любой даты в разделе – «Статистический отчет», «фильтр по физическому лицу». `~`2012-04-09 17:17:42.043000000`~`1`~`5`~`1`~``~`1`|`76`~`314`~`2012-03-23 09:32:10.503000000`~`завис стройформ. Срочно нужно исправить`~`2012-03-23 09:42:10.583000000`~`1`~`366`~`1`~``~`1`|`77`~`165`~`2012-03-23 10:14:30.840000000`~`Не запускается программа.`~`2012-03-23 10:22:47.330000000`~`1`~`366`~`2`~``~`1`|`78`~`97`~`2012-03-26 08:55:11.817000000`~`Не обновляется Стройформ (компьютер Иванова М.А., каб.206)`~`2012-03-26 09:21:01.590000000`~`1`~`366`~`1`~``~`1`|`79`~`314`~`2012-03-30 13:48:33.620000000`~` при переводе документа (извещение о проверке) в word теряются данные ранее занесенные при фотмировании документа.`~`2012-04-02 11:16:48.950000000`~`1`~`366`~`1`~``~`1`|`80`~`314`~`2012-04-02 10:59:20.833000000`~`Повторно! При переводе документа (извещение о проверке) в word теряются данные ранее занесенные при формировании документа.`~`2012-04-02 11:16:48.950000000`~`1`~`366`~`1`~``~`1`|`81`~`165`~`2012-04-04 12:10:45.677000000`~`Не запускается программа`~`2012-04-04 12:12:53.100000000`~`1`~`366`~`2`~``~`1`|`82`~`329`~`2012-04-11 10:29:52.860000000`~`прошу откорректировать мою должность &quot;ведущий специалист СГСН и Э СПб&quot; (убрать управление государственной экспертизы)`~`2012-04-11 15:19:55.877000000`~`1`~`5`~`1`~``~`1`|`83`~`165`~`2012-04-11 12:06:35.123000000`~`Не запускается программа.`~`2012-04-11 12:28:28.937000000`~`1`~`366`~`2`~``~`1`|`84`~`114`~`2012-04-13 08:14:48.630000000`~`Акт проверки не сохраняет содержание при формировании тестового документа. Спасибо.`~`2012-05-22 17:17:03.350000000`~`1`~`395`~`1`~``~`1`|`85`~`329`~`2012-04-16 17:25:42.713000000`~`не исправлена должность в некоторых документах, например дела №78-01003120-2010, №78-11000720-2008, набрала акты от 16.04.12 должность прежняя с красной пометкой &quot;архив&quot; `~`2012-04-18 12:08:28.690000000`~`1`~`5`~`1`~``~`1`|`86`~`165`~`2012-04-17 10:29:26.153000000`~`Не запускается программа.`~`2012-04-17 10:46:32.907000000`~`1`~`366`~`2`~``~`1`|`87`~`165`~`2012-04-17 12:00:19.463000000`~`НЕ ЗАПУСКАЕТСЯ ПРОГРАММА..`~`2012-04-23 09:20:12.917000000`~`1`~`366`~`2`~``~`1`|`88`~`97`~`2012-04-24 14:26:52.920000000`~`Не удается с планшетника зайти в Стройформ, после ввода логина, виснет на вводе пароля...`~`2012-05-24 11:19:09.797000000`~`1`~`395`~`1`~``~`1`|`89`~`329`~`2012-05-02 09:37:22.860000000`~`Заявка от Розановой Т.Д. каб. №211 
